{
  "$schema": "https://json-schema.org/draft/2020-12/schema",
  "$id": "https://github.com/pereirawolf/ki-lead/evaluation/plaene/plan.schema.json",
  "title": "Bewertungsplan KI-LEAD",
  "description": "Vor dem ersten Lauf festgelegte Auswahl von Fällen mit Varianten, Wiederholungen und Budgetgrenze. Ein Plan verweist auf Fälle unter evaluation/faelle/ und kopiert sie nicht; er ist kein Ergebnis.",
  "type": "object",
  "required": ["format", "id", "stand", "fragestellung", "faelle"],
  "additionalProperties": false,
  "properties": {
    "format": { "const": "ki-lead-bewertungsplan/1" },
    "id": { "type": "string", "pattern": "^[a-z0-9]+(-[a-z0-9]+)*$" },
    "stand": { "type": "string", "format": "date" },
    "fragestellung": { "type": "string", "minLength": 1 },
    "faelle": {
      "type": "array",
      "minItems": 1,
      "uniqueItems": true,
      "items": { "type": "string", "pattern": "^[a-z0-9]+(-[a-z0-9]+)*$" },
      "description": "IDs der Fälle unter evaluation/faelle/"
    },
    "varianten": {
      "type": "array",
      "items": {
        "type": "object",
        "required": ["kennung"],
        "additionalProperties": false,
        "properties": {
          "kennung": { "type": "string", "minLength": 1 },
          "s1": { "$ref": "#/$defs/stufe" },
          "s2": { "$ref": "#/$defs/stufe" },
          "material": { "enum": ["ohne", "pdf", "eingaenge", "meldung"] },
          "kurzfassung": { "$ref": "#/$defs/stufe" },
          "reparatur": { "$ref": "#/$defs/stufe", "description": "Modell und Aufwand der Reparatur (S3) im Prüffall Reparatur (Fälle mit auftrag.reparatur)" }
        }
      }
    },
    "wiederholungen": { "type": "integer", "minimum": 1 },
    "budget_usd": { "type": "number", "minimum": 0 },
    "meldung_fest": {
      "type": "object",
      "description": "Feste, fertige Meldung als einzige Eingabe für Bewertungen der Management Summary (Fälle mit auftrag.kurzfassung) oder als Grundlage des Prüffalls Reparatur (Fälle mit auftrag.reparatur). Datei unter evaluation/material/, Prüfsumme sha256 des Dateiinhalts.",
      "required": ["datei", "sha256"],
      "additionalProperties": false,
      "properties": {
        "datei": { "type": "string", "pattern": "^evaluation/material/[a-z0-9-]+\\.json$" },
        "sha256": { "type": "string", "pattern": "^[0-9a-f]{64}$" }
      }
    },
    "s1_fest": {
      "type": "object",
      "description": "Fester, fachlich bestätigter S1-Gegenstand für einen isolierten Vergleich der Verdichtung (LS-2026-W43-15): S1 läuft nicht, jede Variante erhält denselben Gegenstand. Datei unter evaluation/material/, Prüfsumme sha256 des Dateiinhalts.",
      "required": ["datei", "sha256"],
      "additionalProperties": false,
      "properties": {
        "datei": { "type": "string", "pattern": "^evaluation/material/[a-z0-9-]+\\.json$" },
        "sha256": { "type": "string", "pattern": "^[0-9a-f]{64}$" }
      }
    },
    "hinweis": { "type": "string" }
  },
  "$defs": {
    "stufe": {
      "type": "object",
      "required": ["modell", "aufwand"],
      "additionalProperties": false,
      "properties": {
        "modell": { "type": "string", "minLength": 1 },
        "aufwand": { "enum": ["low", "medium", "high", "xhigh", "max"] }
      }
    }
  }
}
