{
  "format": "ki-lead-bewertungsplan/1",
  "id": "reparatur-ilka",
  "stand": "2026-10-25",
  "fragestellung": "Welches Modell repariert einen Entwurf mit Schemafehlern (S3) zuverlässig, ohne die übrigen Inhalte zu verändern? In den Vergleichsreihen A–G und M1/M2 war S3 nie nötig; deshalb erhält jede Variante dieselbe Musterfassung Ilka (meldung_fest) mit fünf festgelegten Defekten R1–R5 (Radarwert außerhalb der Skala, unzulässige Beurteilung, unbekannte Ereignisart, Radarwert als Text, drei Fehler zugleich), S1 fest nach Zuschnitt A, S2 ohne KI-Aufruf. Gemessen je Fall: schemakonform nach der Reparatur, Zahl der Reparaturen (höchstens zwei), Anteil der übrigen Inhalte, die unverändert bleiben (Soll: unbeschädigter Durchlauf), Wert an den beschädigten Stellen (seit App 0.5.15 als Kennzahl „Stellen wie Original“, leere Werte zählen nicht; AV-2026-W43-35); Kosten und Dauer werden berichtet, entscheiden aber nicht. Entscheidend ist zuerst die Zuverlässigkeit (alle Fälle schemakonform, Inhalte vollständig erhalten), dann die Kosten. Kein Gesamtwert.",
  "faelle": ["ilka-reparatur"],
  "varianten": [
    { "kennung": "R-A-sonnet-niedrig", "reparatur": { "modell": "claude-sonnet-5-5", "aufwand": "low" }, "material": "meldung" },
    { "kennung": "R-B-haiku-niedrig", "reparatur": { "modell": "claude-haiku-5-5", "aufwand": "low" }, "material": "meldung" },
    { "kennung": "R-C-sol-niedrig", "reparatur": { "modell": "gpt-6.1-sol", "aufwand": "low" }, "material": "meldung" },
    { "kennung": "R-D-luna-niedrig", "reparatur": { "modell": "gpt-6-luna", "aufwand": "low" }, "material": "meldung" },
    { "kennung": "R-E-mistral-small", "reparatur": { "modell": "mistral-small-2603", "aufwand": "low" }, "material": "meldung" },
    { "kennung": "R-F-mistral-medium-niedrig", "reparatur": { "modell": "mistral-medium-3-5", "aufwand": "low" }, "material": "meldung" }
  ],
  "wiederholungen": 2,
  "budget_usd": 10,
  "meldung_fest": {
    "datei": "evaluation/material/ilka-musterfassung.json",
    "sha256": "953f7682838c10f84458312bc563cf9d0f17b16bd715fd27ad9cb26ff84de4cf"
  },
  "s1_fest": {
    "datei": "evaluation/material/ilka-s1-zuschnitt-a.json",
    "sha256": "f7b14d5bf1b16959ede77698f21452560c5fb4ced4ab76e1c5aa450ee22cb319"
  },
  "hinweis": "Durchführung in der App: Einstellungen → Modelle & Verarbeitung → Prüffall Reparatur, Konfiguration „Plan reparatur-ilka, Variante …“, Durchgänge 2 (je Durchgang alle fünf Defekte, also zehn Fälle je Variante); alle Varianten mit derselben App-Version. Schlüssel nur für den Anbieter der Reparatur nötig; Mistral über den EU-Endpunkt. A und C sind die Reparaturmodelle der Standard-Profile Anthropic und OpenAI, E das des Standard-Profils Mistral; B und D sind die günstigsten Modelle der Anbieter. Ergebnis je Variante als ZIP (ki-lead-reparaturtest/1); Laufprotokolle und reparierte Entwürfe bleiben außerhalb des Repositorys, eingecheckt wird nur die Zusammenfassung. Schätzung (Listenpreise, ohne Gewähr, ohne Messwert): je Reparatur etwa 10.000–14.000 Eingabe- und 8.000–16.000 Ausgabetoken; je Variante mit zehn Fällen (eine bis zwei Reparaturen je Fall) A und C etwa 1–3,8 USD, B, D und E unter 0,30 USD. Fassung 2 vom 25.10.2026 (AV-2026-W43-38): Variante R-F (mistral-medium-3-5 „low“) nachträglich aufgenommen, nachdem R-E Inhalte löschte; ihr Lauf vom 25.10.2026 wurde mit „Aktuelle Einstellungen“ gestartet und trägt keine Variantenkennung. Seit 0.5.15 gilt eine geschärfte Anweisung der Reparatur (AV-2026-W43-34); Läufe davor und danach sind nicht unmittelbar vergleichbar. Ergebnis: evaluation/abnahmen/2026-10-25-reparatur-ilka-ergebnis.md."
}
